tweet_text,user_id,hashtags,time,url
@cochranecollab so when will we get a Cochrane review of whether CO2 emissions reduction will prevent the adverse health impacts of climate change? It will state: “not a shred of evidence”. Maybe let Conly lead it with Heneghan as an unlisted author.🧵,1634330528836112384,,2023-03-10 23:08:57 +0000 +0000,https://twitter.com/ToshiAkima/status/1634330528836112384
"Canada's spy service claims climate change threatens national security and prosperity, including arctic security, environmental degradation, and violent extremism.

MORE: https://t.co/8KZBYlXtF6 https://t.co/Esv4gjOlIn",1634333451141652480,,2023-03-10 23:20:33 +0000 +0000,https://twitter.com/RebelNewsOnline/status/1634333451141652480
"Climate change slowing down, not speeding up, movement of large Arctic rivers: study https://t.co/XtdDAtMv5O https://t.co/1ufQHk4MUg",1634341766710312960,,2023-03-10 23:53:36 +0000 +0000,https://twitter.com/GlobalNational/status/1634341766710312960
"65+ @USAID Environment Officers spent the week in #Colombia sharing lessons learned, providing thought leadership, &amp; developing ideas 4 how to tackle climate change &amp; support regional development globally. #climate #2023EnvironmentOfficersConference @USAID_Colombia @USAIDEnviro https://t.co/c1w2eGFln3",1634305715627081733,"Colombia,climate,2023EnvironmentOfficersConference",2023-03-10 21:30:21 +0000 +0000,https://twitter.com/USAIDLAC/status/1634305715627081733
"DMD Okamura: Wonderful to meet with the 🇲🇷 Prime Minister, President, Governor of @bcmauritanie and other government officials to discuss their new 42-month IMF-supported program, inclusive growth and climate change challenges. Learn more about my trip: https://t.co/joVsIpeTru https://t.co/yBwkTVZr9t",1634324730886115329,,2023-03-10 22:45:54 +0000 +0000,https://twitter.com/IMFinMENA/status/1634324730886115329
@OzraeliAvi @GretaThunberg Looks like climate change wiped out her tweet,1634314888431697920,,2023-03-10 22:06:48 +0000 +0000,https://twitter.com/garry_harman/status/1634314888431697920
"CS Tuya: We want to amend the Climate Change Act to enable us tap into the  multi-billion sector industry of the Carbon Market.
#TheGreatKBC ^RO https://t.co/MTxq26GbBL",1634305124159070208,TheGreatKBC,2023-03-10 21:28:00 +0000 +0000,https://twitter.com/KBCChannel1/status/1634305124159070208
"On Friday, the extremist House Freedom Caucus released their budgetary demands. They want to slash Biden’s plan for relieving over 40 million people from student debt burdens, to rescind unspent Covid-19 funds, and to cut climate change funding. https://t.co/sn5WPInZBz",1634324833013039113,,2023-03-10 22:46:19 +0000 +0000,https://twitter.com/newrepublic/stat